[
  {"id":"sr-001","subject":"math","unit":"square-root-basics","difficulty":"basic","question":"√25 の値はどれか。","choices":[{"label":"A","text":"5"},{"label":"B","text":"±5"},{"label":"C","text":"-5"},{"label":"D","text":"12.5"}],"correct":"A","reasoning_tags":["平方根の定義","√は正の値"]},
  {"id":"sr-002","subject":"math","unit":"square-root-basics","difficulty":"basic","question":"2乗すると7になる数の正の方はどれか。","choices":[{"label":"A","text":"√7"},{"label":"B","text":"7"},{"label":"C","text":"√14"},{"label":"D","text":"3.5"}],"correct":"A","reasoning_tags":["平方根の定義","正の平方根"]},
  {"id":"sr-003","subject":"math","unit":"square-root-basics","difficulty":"basic","question":"(√6)² の値はどれか。","choices":[{"label":"A","text":"6"},{"label":"B","text":"√6"},{"label":"C","text":"36"},{"label":"D","text":"3"}],"correct":"A","reasoning_tags":["根号の2乗","定義"]},
  {"id":"sr-004","subject":"math","unit":"square-root-basics","difficulty":"basic","question":"√18 を簡略化すると？","choices":[{"label":"A","text":"3√2"},{"label":"B","text":"2√3"},{"label":"C","text":"6√3"},{"label":"D","text":"√18"}],"correct":"A","reasoning_tags":["根号の簡略化","素因数分解"]},
  {"id":"sr-005","subject":"math","unit":"square-root-basics","difficulty":"basic","question":"√2 × √8 を計算すると？","choices":[{"label":"A","text":"4"},{"label":"B","text":"2√4"},{"label":"C","text":"√10"},{"label":"D","text":"2√2"}],"correct":"A","reasoning_tags":["根号の積","√a×√b=√ab"]},
  {"id":"sr-006","subject":"math","unit":"square-root-basics","difficulty":"basic","question":"√3 × √3 の値はどれか。","choices":[{"label":"A","text":"3"},{"label":"B","text":"√6"},{"label":"C","text":"9"},{"label":"D","text":"√9"}],"correct":"A","reasoning_tags":["根号の2乗","同じ数の積"]},
  {"id":"sr-007","subject":"math","unit":"square-root-basics","difficulty":"basic","question":"3√2 + 5√2 を計算すると？","choices":[{"label":"A","text":"8√2"},{"label":"B","text":"8√4"},{"label":"C","text":"15√2"},{"label":"D","text":"8√2+5"}],"correct":"A","reasoning_tags":["同類根号の加算","まとめる"]},
  {"id":"sr-008","subject":"math","unit":"square-root-basics","difficulty":"basic","question":"√12 - √3 を計算すると？","choices":[{"label":"A","text":"√3"},{"label":"B","text":"√9"},{"label":"C","text":"3√3"},{"label":"D","text":"√6"}],"correct":"A","reasoning_tags":["根号の減算","√12=2√3"]},
  {"id":"sr-009","subject":"math","unit":"square-root-basics","difficulty":"basic","question":"6/√3 を有理化すると？","choices":[{"label":"A","text":"2√3"},{"label":"B","text":"6√3"},{"label":"C","text":"√18"},{"label":"D","text":"3√2"}],"correct":"A","reasoning_tags":["有理化","分母の根号を消す"]},
  {"id":"sr-010","subject":"math","unit":"square-root-basics","difficulty":"basic","question":"次の中で最も大きい数はどれか。","choices":[{"label":"A","text":"√11"},{"label":"B","text":"3"},{"label":"C","text":"√8"},{"label":"D","text":"√10"}],"correct":"A","reasoning_tags":["根号の大小比較","2乗して比較"]},
  {"id":"sr-011","subject":"math","unit":"square-root-basics","difficulty":"standard","question":"√2(√8 - √2) を展開すると？","choices":[{"label":"A","text":"2"},{"label":"B","text":"4"},{"label":"C","text":"2√2"},{"label":"D","text":"√16-2"}],"correct":"A","reasoning_tags":["根号を含む展開","分配法則"]},
  {"id":"sr-012","subject":"math","unit":"square-root-basics","difficulty":"standard","question":"(√5 + √3)(√5 - √3) を計算すると？","choices":[{"label":"A","text":"2"},{"label":"B","text":"8"},{"label":"C","text":"√2"},{"label":"D","text":"2√5"}],"correct":"A","reasoning_tags":["和と差の積","(a+b)(a-b)=a²-b²"]},
  {"id":"sr-013","subject":"math","unit":"square-root-basics","difficulty":"standard","question":"(√3 + 1)² を展開すると？","choices":[{"label":"A","text":"4+2√3"},{"label":"B","text":"4"},{"label":"C","text":"3+1"},{"label":"D","text":"2+2√3"}],"correct":"A","reasoning_tags":["根号を含む展開","(a+b)²公式"]},
  {"id":"sr-014","subject":"math","unit":"square-root-basics","difficulty":"standard","question":"√27 + √48 - √75 を計算すると？","choices":[{"label":"A","text":"2√3"},{"label":"B","text":"4√3"},{"label":"C","text":"0"},{"label":"D","text":"6√3"}],"correct":"A","reasoning_tags":["根号の加減","簡略化後に計算"]},
  {"id":"sr-015","subject":"math","unit":"square-root-basics","difficulty":"standard","question":"1/(√5+√2) を有理化すると？","choices":[{"label":"A","text":"(√5-√2)/3"},{"label":"B","text":"(√5+√2)/3"},{"label":"C","text":"1/(√5-√2)"},{"label":"D","text":"(√5-√2)/7"}],"correct":"A","reasoning_tags":["共役式による有理化","(a+b)(a-b)"]},
  {"id":"sr-016","subject":"math","unit":"square-root-basics","difficulty":"standard","question":"√50 ÷ √2 を計算すると？","choices":[{"label":"A","text":"5"},{"label":"B","text":"√25"},{"label":"C","text":"5√2"},{"label":"D","text":"√100"}],"correct":"A","reasoning_tags":["根号の除算","√a/√b=√(a/b)"]},
  {"id":"sr-017","subject":"math","unit":"square-root-basics","difficulty":"standard","question":"2/√6 を有理化して最も簡単な形にすると？","choices":[{"label":"A","text":"√6/3"},{"label":"B","text":"2√6/6"},{"label":"C","text":"√6/6"},{"label":"D","text":"2/√6"}],"correct":"A","reasoning_tags":["有理化","約分"]},
  {"id":"sr-018","subject":"math","unit":"square-root-basics","difficulty":"standard","question":"(2+√3)(2-√3) を計算すると？","choices":[{"label":"A","text":"1"},{"label":"B","text":"4-3"},{"label":"C","text":"7"},{"label":"D","text":"4+3"}],"correct":"A","reasoning_tags":["和と差の積","整数になる場合"]},
  {"id":"sr-019","subject":"math","unit":"square-root-basics","difficulty":"standard","question":"√5 × √20 を計算すると？","choices":[{"label":"A","text":"10"},{"label":"B","text":"√25"},{"label":"C","text":"5√4"},{"label":"D","text":"2√25"}],"correct":"A","reasoning_tags":["根号の積","結果が整数"]},
  {"id":"sr-020","subject":"math","unit":"square-root-basics","difficulty":"standard","question":"√3(√12 + √3) を展開すると？","choices":[{"label":"A","text":"9"},{"label":"B","text":"6"},{"label":"C","text":"3√4+3"},{"label":"D","text":"√36+3"}],"correct":"A","reasoning_tags":["分配と根号の乗算","展開"]},
  {"id":"sr-021","subject":"math","unit":"square-root-basics","difficulty":"exam","question":"x = √3+1 のとき x²-2x の値を求めよ。","choices":[{"label":"A","text":"2"},{"label":"B","text":"4"},{"label":"C","text":"2+2√3"},{"label":"D","text":"6"}],"correct":"A","reasoning_tags":["式の値","因数分解して代入"]},
  {"id":"sr-022","subject":"math","unit":"square-root-basics","difficulty":"exam","question":"√7 の整数部分は2で、小数部分を a とすると a² + 4a の値はどれか。","choices":[{"label":"A","text":"7-4√7+8"},{"label":"B","text":"3"},{"label":"C","text":"4√7-8"},{"label":"D","text":"11-4√7"}],"correct":"D","reasoning_tags":["整数部分・小数部分","式の値"]},
  {"id":"sr-023","subject":"math","unit":"square-root-basics","difficulty":"exam","question":"x = √5+√3, y = √5-√3 のとき x²+y² の値はどれか。","choices":[{"label":"A","text":"16"},{"label":"B","text":"4"},{"label":"C","text":"2√15"},{"label":"D","text":"8+2√15"}],"correct":"A","reasoning_tags":["対称式","x²+y²=(x+y)²-2xy"]},
  {"id":"sr-024","subject":"math","unit":"square-root-basics","difficulty":"exam","question":"√12+√27 を計算した結果はどれか。","choices":[{"label":"A","text":"5√3"},{"label":"B","text":"√39"},{"label":"C","text":"3√3"},{"label":"D","text":"7√3"}],"correct":"A","reasoning_tags":["根号の加算","簡略化が必要"]},
  {"id":"sr-025","subject":"math","unit":"square-root-basics","difficulty":"exam","question":"(√6+√2)² を展開すると？","choices":[{"label":"A","text":"8+4√3"},{"label":"B","text":"8"},{"label":"C","text":"8+2√12"},{"label":"D","text":"6+2"}],"correct":"A","reasoning_tags":["2変数の展開","(a+b)²"]},
  {"id":"sr-026","subject":"math","unit":"square-root-basics","difficulty":"exam","question":"n² ≦ 30 < (n+1)² を満たす整数 n はいくつか（n > 0）。","choices":[{"label":"A","text":"5"},{"label":"B","text":"6"},{"label":"C","text":"4"},{"label":"D","text":"7"}],"correct":"A","reasoning_tags":["平方根と整数の関係","不等式"]},
  {"id":"sr-027","subject":"math","unit":"square-root-basics","difficulty":"exam","question":"x = 2-√3 のとき 1/x を有理化した形はどれか。","choices":[{"label":"A","text":"2+√3"},{"label":"B","text":"2-√3"},{"label":"C","text":"-(2+√3)"},{"label":"D","text":"1/(2-√3)"}],"correct":"A","reasoning_tags":["逆数の有理化","共役式"]},
  {"id":"sr-028","subject":"math","unit":"square-root-basics","difficulty":"exam","question":"√(5-2√6) を簡略化すると？","choices":[{"label":"A","text":"√3-√2"},{"label":"B","text":"√3+√2"},{"label":"C","text":"√5-√6"},{"label":"D","text":"√(5-2√6)"}],"correct":"A","reasoning_tags":["二重根号の簡略化","(√3-√2)²=5-2√6"]},
  {"id":"sr-029","subject":"math","unit":"square-root-basics","difficulty":"exam","question":"x+y=4, xy=2 のとき √x+√y の値として正しいのはどれか（x,y>0）。","choices":[{"label":"A","text":"√(4+2√2)"},{"label":"B","text":"4"},{"label":"C","text":"2√2"},{"label":"D","text":"√6"}],"correct":"A","reasoning_tags":["対称式の応用","(√x+√y)²=x+y+2√xy"]},
  {"id":"sr-030","subject":"math","unit":"square-root-basics","difficulty":"exam","question":"3/（√7+2）を有理化すると？","choices":[{"label":"A","text":"√7-2"},{"label":"B","text":"3(√7-2)"},{"label":"C","text":"√7+2"},{"label":"D","text":"3/(√7-2)"}],"correct":"A","reasoning_tags":["有理化","3/(√7+2)=(√7-2)/1"]}
]
