[
  {"id":"ef-001","subject":"math","unit":"expansion-factoring","difficulty":"basic","question":"(x+3)² を展開すると？","choices":[{"label":"A","text":"x²+6x+9"},{"label":"B","text":"x²+9"},{"label":"C","text":"x²+3x+9"},{"label":"D","text":"x²-6x+9"}],"correct":"A","reasoning_tags":["(a+b)²公式","展開"]},
  {"id":"ef-002","subject":"math","unit":"expansion-factoring","difficulty":"basic","question":"(x-4)² を展開すると？","choices":[{"label":"A","text":"x²-8x+16"},{"label":"B","text":"x²+16"},{"label":"C","text":"x²-4x+16"},{"label":"D","text":"x²+8x+16"}],"correct":"A","reasoning_tags":["(a-b)²公式","展開"]},
  {"id":"ef-003","subject":"math","unit":"expansion-factoring","difficulty":"basic","question":"(x+5)(x-5) を展開すると？","choices":[{"label":"A","text":"x²-25"},{"label":"B","text":"x²+25"},{"label":"C","text":"x²-10x-25"},{"label":"D","text":"x²+10x-25"}],"correct":"A","reasoning_tags":["差の積公式","展開"]},
  {"id":"ef-004","subject":"math","unit":"expansion-factoring","difficulty":"basic","question":"(x+3)(x+4) を展開すると？","choices":[{"label":"A","text":"x²+7x+12"},{"label":"B","text":"x²+12x+7"},{"label":"C","text":"x²+12"},{"label":"D","text":"x²-7x+12"}],"correct":"A","reasoning_tags":["(x+a)(x+b)公式","展開"]},
  {"id":"ef-005","subject":"math","unit":"expansion-factoring","difficulty":"basic","question":"x²+4x+4 を因数分解すると？","choices":[{"label":"A","text":"(x+2)²"},{"label":"B","text":"(x-2)²"},{"label":"C","text":"(x+4)(x+1)"},{"label":"D","text":"(x+2)(x-2)"}],"correct":"A","reasoning_tags":["完全平方式","因数分解"]},
  {"id":"ef-006","subject":"math","unit":"expansion-factoring","difficulty":"basic","question":"6x²+9x を因数分解すると？","choices":[{"label":"A","text":"3x(2x+3)"},{"label":"B","text":"3(2x²+3x)"},{"label":"C","text":"x(6x+9)"},{"label":"D","text":"9x(x+1)"}],"correct":"A","reasoning_tags":["共通因数","括り出し"]},
  {"id":"ef-007","subject":"math","unit":"expansion-factoring","difficulty":"basic","question":"x²-9 を因数分解すると？","choices":[{"label":"A","text":"(x+3)(x-3)"},{"label":"B","text":"(x-3)²"},{"label":"C","text":"(x+9)(x-1)"},{"label":"D","text":"(x-9)(x+1)"}],"correct":"A","reasoning_tags":["差の平方","因数分解"]},
  {"id":"ef-008","subject":"math","unit":"expansion-factoring","difficulty":"basic","question":"x²+5x+6 を因数分解すると？","choices":[{"label":"A","text":"(x+2)(x+3)"},{"label":"B","text":"(x+1)(x+6)"},{"label":"C","text":"(x-2)(x-3)"},{"label":"D","text":"(x+6)(x-1)"}],"correct":"A","reasoning_tags":["たすきがけ","因数分解"]},
  {"id":"ef-009","subject":"math","unit":"expansion-factoring","difficulty":"basic","question":"x²-7x+12 を因数分解すると���","choices":[{"label":"A","text":"(x-3)(x-4)"},{"label":"B","text":"(x+3)(x+4)"},{"label":"C","text":"(x-12)(x+1)"},{"label":"D","text":"(x-6)(x-2)"}],"correct":"A","reasoning_tags":["たすきがけ","負の定数項"]},
  {"id":"ef-010","subject":"math","unit":"expansion-factoring","difficulty":"basic","question":"x²-10x+25 を因数分解すると？","choices":[{"label":"A","text":"(x-5)²"},{"label":"B","text":"(x+5)²"},{"label":"C","text":"(x-5)(x+5)"},{"label":"D","text":"(x-25)(x+1)"}],"correct":"A","reasoning_tags":["完全平方式","負の中間項"]},
  {"id":"ef-011","subject":"math","unit":"expansion-factoring","difficulty":"standard","question":"(2x+3)² を展開すると？","choices":[{"label":"A","text":"4x²+12x+9"},{"label":"B","text":"4x²+9"},{"label":"C","text":"2x²+12x+9"},{"label":"D","text":"4x²-12x+9"}],"correct":"A","reasoning_tags":["係数2の展開","(a+b)²"]},
  {"id":"ef-012","subject":"math","unit":"expansion-factoring","difficulty":"standard","question":"(3x-2)(3x+2) を展開すると？","choices":[{"label":"A","text":"9x²-4"},{"label":"B","text":"9x²+4"},{"label":"C","text":"6x²-4"},{"label":"D","text":"9x²-12x-4"}],"correct":"A","reasoning_tags":["差の積公式","係数3"]},
  {"id":"ef-013","subject":"math","unit":"expansion-factoring","difficulty":"standard","question":"2x²-8 を因数分解すると？","choices":[{"label":"A","text":"2(x+2)(x-2)"},{"label":"B","text":"2(x-2)²"},{"label":"C","text":"(2x+4)(x-2)"},{"label":"D","text":"2(x²-4)"}],"correct":"A","reasoning_tags":["共通因数+差の平方","2段階"]},
  {"id":"ef-014","subject":"math","unit":"expansion-factoring","difficulty":"standard","question":"3x²-12x+12 を因数分解すると？","choices":[{"label":"A","text":"3(x-2)²"},{"label":"B","text":"3(x+2)²"},{"label":"C","text":"(3x-6)²"},{"label":"D","text":"3(x²-4x+4)"}],"correct":"A","reasoning_tags":["共通因数+完全平方","2段階"]},
  {"id":"ef-015","subject":"math","unit":"expansion-factoring","difficulty":"standard","question":"(x+1)(x+2)(x+3)(x+4) を工夫して展開するとき、(x+1)(x+4) を先に展開した結果はどれか。","choices":[{"label":"A","text":"x²+5x+4"},{"label":"B","text":"x²+4x+4"},{"label":"C","text":"x²+5x+3"},{"label":"D","text":"x²+3x+4"}],"correct":"A","reasoning_tags":["工夫した展開","積の順序"]},
  {"id":"ef-016","subject":"math","unit":"expansion-factoring","difficulty":"standard","question":"101² を乗法公式を使って計算すると？","choices":[{"label":"A","text":"10201"},{"label":"B","text":"10101"},{"label":"C","text":"10100"},{"label":"D","text":"10401"}],"correct":"A","reasoning_tags":["計算の工夫","(100+1)²"]},
  {"id":"ef-017","subject":"math","unit":"expansion-factoring","difficulty":"standard","question":"x²+2xy+y² を因数分解すると？","choices":[{"label":"A","text":"(x+y)²"},{"label":"B","text":"(x-y)²"},{"label":"C","text":"(x+y)(x-y)"},{"label":"D","text":"(x+2y)²"}],"correct":"A","reasoning_tags":["2変数の因数分解","完全平方"]},
  {"id":"ef-018","subject":"math","unit":"expansion-factoring","difficulty":"standard","question":"x²-y² を因数分解すると？","choices":[{"label":"A","text":"(x+y)(x-y)"},{"label":"B","text":"(x-y)²"},{"label":"C","text":"(x+y)²"},{"label":"D","text":"(x-2y)(x+2y)"}],"correct":"A","reasoning_tags":["2変数の差の平方","因数分解"]},
  {"id":"ef-019","subject":"math","unit":"expansion-factoring","difficulty":"standard","question":"ax²+2ax+a を因数分解すると？","choices":[{"label":"A","text":"a(x+1)²"},{"label":"B","text":"a(x-1)²"},{"label":"C","text":"(ax+1)²"},{"label":"D","text":"a(x+1)(x-1)"}],"correct":"A","reasoning_tags":["共通因数a","完全平方式"]},
  {"id":"ef-020","subject":"math","unit":"expansion-factoring","difficulty":"standard","question":"98×102 を乗法公式を利用して計算すると？","choices":[{"label":"A","text":"9996"},{"label":"B","text":"9604"},{"label":"C","text":"10000"},{"label":"D","text":"9800"}],"correct":"A","reasoning_tags":["(a+b)(a-b)=a²-b²","計算の工夫"]},
  {"id":"ef-021","subject":"math","unit":"expansion-factoring","difficulty":"exam","question":"連続する2つの整数の積に1を加えると、いつも完全平方数（整数の2乗）になる。整数 n と n+1 を使って式を展開すると何の2乗か。","choices":[{"label":"A","text":"(n+1)²"},{"label":"B","text":"n²"},{"label":"C","text":"(n+2)²"},{"label":"D","text":"(2n+1)²"}],"correct":"A","reasoning_tags":["整数の証明","展開"]},
  {"id":"ef-022","subject":"math","unit":"expansion-factoring","difficulty":"exam","question":"(x+y)=5、xy=4 のとき x²+y² の値を求めよ。","choices":[{"label":"A","text":"17"},{"label":"B","text":"21"},{"label":"C","text":"25"},{"label":"D","text":"9"}],"correct":"A","reasoning_tags":["対称式","展開の応用"]},
  {"id":"ef-023","subject":"math","unit":"expansion-factoring","difficulty":"exam","question":"x²-6x+9 と x²-9 の積を因数分解すると？","choices":[{"label":"A","text":"(x-3)³(x+3)"},{"label":"B","text":"(x-3)²(x+3)"},{"label":"C","text":"(x-3)(x+3)³"},{"label":"D","text":"(x-3)⁴"}],"correct":"A","reasoning_tags":["積の因数分解","複合問���"]},
  {"id":"ef-024","subject":"math","unit":"expansion-factoring","difficulty":"exam","question":"x=√5+2 のとき x²-4x+4 の値を求めよ。","choices":[{"label":"A","text":"5"},{"label":"B","text":"4"},{"label":"C","text":"9"},{"label":"D","text":"1"}],"correct":"A","reasoning_tags":["式の値","因数分解を使う"]},
  {"id":"ef-025","subject":"math","unit":"expansion-factoring","difficulty":"exam","question":"(a+b)²-(a-b)² を因数分解すると？","choices":[{"label":"A","text":"4ab"},{"label":"B","text":"2ab"},{"label":"C","text":"4a²"},{"label":"D","text":"4b²"}],"correct":"A","reasoning_tags":["2式の差の因数分解","展開後整理"]},
  {"id":"ef-026","subject":"math","unit":"expansion-factoring","difficulty":"exam","question":"2025 × 2027 を乗法公式を利用して計算すると？","choices":[{"label":"A","text":"4103675"},{"label":"B","text":"4104676"},{"label":"C","text":"4103676"},{"label":"D","text":"4100000"}],"correct":"A","reasoning_tags":["計算の工夫","(a-1)(a+1)=a²-1"]},
  {"id":"ef-027","subject":"math","unit":"expansion-factoring","difficulty":"exam","question":"x²+x-6 を因数分解すると？","choices":[{"label":"A","text":"(x+3)(x-2)"},{"label":"B","text":"(x-3)(x+2)"},{"label":"C","text":"(x+6)(x-1)"},{"label":"D","text":"(x-6)(x+1)"}],"correct":"A","reasoning_tags":["符号が混在","たすきがけ"]},
  {"id":"ef-028","subject":"math","unit":"expansion-factoring","difficulty":"exam","question":"偶数の2乗から奇数の2乗を引いた結果は常に奇数になる。偶数を2n、奇数を2n+1 と表して計算した結果はどれか。","choices":[{"label":"A","text":"-(4n+1)"},{"label":"B","text":"4n+1"},{"label":"C","text":"-(2n+1)"},{"label":"D","text":"4n-1"}],"correct":"A","reasoning_tags":["整数の証明","偶数と奇数"]},
  {"id":"ef-029","subject":"math","unit":"expansion-factoring","difficulty":"exam","question":"x-y=3、x+y=7 のとき x²-y² の値を求めよ。","choices":[{"label":"A","text":"21"},{"label":"B","text":"40"},{"label":"C","text":"10"},{"label":"D","text":"58"}],"correct":"A","reasoning_tags":["差の平方の応用","因数分解"]},
  {"id":"ef-030","subject":"math","unit":"expansion-factoring","difficulty":"exam","question":"x²-5x+6 を因数分解して x=2 を代入した値を求めよ。","choices":[{"label":"A","text":"0"},{"label":"B","text":"2"},{"label":"C","text":"-4"},{"label":"D","text":"4"}],"correct":"A","reasoning_tags":["因数分解後に代入","根の確認"]}
]
